cod_frases,Frase_reflexiva,data
cod_1,"""A verdadeira beleza está na simplicidade da alma e na sinceridade do coração. Cultive essas qualidades e verá o mundo se abrir diante de você.""",2024-07-06
cod_2,"""Assim como uma semente precisa ser plantada e regada para crescer, nossos sonhos precisam de dedicação e persistência para se realizarem. Nunca desista de regar seus sonhos com amor e ação.""",2024-07-06
cod_3,"""Não há sonho tão distante que não possa ser alcançado com determinação e fé. Acredite em si mesmo e siga em frente, a jornada é longa, mas a recompensa é certa.""",2024-07-06
cod_4,"""Em meio às tempestades da vida, lembre-se que o arco-íris só surge após a chuva. Tenha fé e perseverança, pois melhores dias sempre virão.""",2024-07-06
cod_5,"""A verdadeira beleza está no modo como você encara a vida, nas pequenas alegrias do dia a dia e no amor que você compartilha com aqueles que te rodeiam.""",2024-07-06
cod_6,"""Que a vida te traga sempre motivos para sorrir, força para seguir em frente e amor para preencher o coração. Você é capaz de alcançar tudo o que deseja, basta acreditar em si mesmo.""",2024-07-06
cod_7,"""A vida é uma jornada repleta de desafios, mas é na superação deles que encontramos nossa verdadeira força e crescimento. Mantenha a fé e siga em frente, pois cada obstáculo é uma oportunidade de evoluir e se tornar alguém ainda mais forte e resiliente.""",2024-07-06
cod_8,"""Que a luz da tua alma brilhe sempre tão forte que ilumine o caminho daqueles que estão ao teu redor, que a tua presença seja um bálsamo de paz e amor para todos que cruzarem o teu caminho.""",2024-07-06
cod_9,"""Que a luz da esperança ilumine sempre o seu caminho, e que a força do amor guie seus passos em direção à felicidade.""",2024-07-06
cod_10,"""Que cada amanhecer seja uma nova oportunidade de ser feliz e fazer alguém feliz. A vida é feita de pequenos gestos de amor e compaixão.""",2024-07-06
cod_11,"""Nunca subestime a força que há dentro de você. Você é capaz de superar todos os desafios que a vida lhe apresentar. Acredite em si mesmo e siga em frente, pois o sucesso está logo ali, esperando por você.""",2024-07-06
cod_12,"""Que a paz e a serenidade possam sempre guiar seus passos, iluminando o caminho com amor e sabedoria.""",2024-07-06
cod_13,"""O tempo é o melhor remédio para curar feridas, a paciência é a melhor aliada para superar desafios.""",2024-07-06
cod_14,"""Que a luz da esperança guie seus passos, iluminando o caminho em direção aos seus sonhos mais profundos.""",2024-07-06
cod_15,"""Que a luz da esperança ilumine seu caminho e o amor guie seus passos, tornando cada desafio em uma oportunidade de crescimento e transformação.""",2024-07-06
cod_16,"""Que a luz da esperança ilumine sempre o seu caminho, trazendo paz e força para enfrentar qualquer desafio que a vida possa te apresentar.""",2024-07-06
cod_17,"""A vida é um presente precioso, valorize cada momento e cultive as boas energias ao seu redor, pois a felicidade reside nas pequenas coisas do dia a dia.""",2024-07-06
cod_18,"""Que a luz da esperança ilumine sempre o seu caminho, guiando seus passos com amor e sabedoria.""",2024-07-06
cod_19,"""Que a luz da esperança guie sempre seus passos e ilumine seu caminho, mostrando que a beleza da vida está em cada pequeno detalhe.""",2024-07-06
cod_20,"""A vida é um presente precioso, então não deixe de valorizar cada momento ao lado daqueles que amamos.""",2024-07-06
cod_21,"""O amor e a bondade são os ingredientes essenciais para uma vida plena e feliz. Cultive-os em seu coração e distribua-os ao mundo ao seu redor.""",2024-07-06
cod_22,"""Que a luz da esperança sempre ilumine seu caminho, te dando forças para superar os desafios e alcançar seus sonhos.""",2024-07-06
cod_23,"""Que a luz da esperança ilumine sempre o teu caminho, guiando-te para a felicidade e a paz interior.""",2024-07-06
cod_24,"""A vida é uma jornada cheia de altos e baixos, mas é nas adversidades que encontramos força para seguir em frente e nos tornarmos quem realmente somos.""",2024-07-06
cod_25,"""A vida é um presente precioso, aproveite cada momento com gratidão e amor.""",2024-07-06
cod_26,"""Dentro de você há uma força imensa capaz de superar qualquer desafio. Acredite no seu potencial e siga em frente com coragem e determinação.""",2024-07-06
cod_27,"""Que a beleza da vida esteja sempre presente em seus dias, colorindo seu caminho com a luz da esperança e o brilho da gratidão.""",2024-07-06
cod_28,"""Que a luz da esperança ilumine sempre o caminho do seu coração, trazendo paz, amor e felicidade em todos os seus dias.""",2024-07-06
cod_29,"""Que a luz da esperança ilumine sempre o seu caminho, guiando seus passos rumo à felicidade e realização.""",2024-07-06
cod_30,"""Que a luz da esperança ilumine sempre o seu caminho, pois cada obstáculo é uma oportunidade de crescimento e superação. Acredite em si mesmo e siga em frente com determinação e coragem.""",2024-07-06
cod_31,"""Às vezes, o que parece um obstáculo pode ser a oportunidade perfeita para crescermos e nos tornarmos mais fortes.""",2024-07-06
cod_32,"""Que a luz da esperança e da gratidão ilumine sempre o seu caminho, tornando cada desafio uma oportunidade de crescimento e aprendizado.""",2024-07-06
cod_33,"""Que a luz da esperança ilumine sempre o caminho daqueles que buscam a paz interior e a felicidade verdadeira.""",2024-07-06
cod_34,"""Que a luz da esperança ilumine sempre o caminho do seu coração, mostrando que mesmo nos momentos mais sombrios, sempre há uma oportunidade de brilhar.""",2024-07-06
cod_35,"""Que a luz da esperança ilumine sempre o caminho do teu coração, guiando-te rumo à felicidade e à realização dos teus sonhos.""",2024-07-06
cod_36,"""A vida é como um livro, cada dia é uma nova página em branco esperando para ser preenchida com momentos inesquecíveis e lições valiosas. Aproveite cada oportunidade para escrever uma bela história.""",2024-07-06
cod_37,"""Às vezes, a maior sabedoria está em saber esperar o tempo certo para que as coisas aconteçam.""",2024-07-06
cod_38,"""Que a luz da esperança ilumine seu caminho e a força do amor te guie em cada passo.""",2024-07-06
cod_39,"""Que a luz da esperança ilumine seu caminho e que a força do amor te guie em todas as decisões.""",2024-07-06
cod_40,"""Não importa o quão difícil seja o caminho, lembre-se que cada desafio superado te torna mais forte e resiliente. Acredite no seu potencial e nunca desista dos seus sonhos.""",2024-07-06
cod_41,"""Que a luz da esperança ilumine seu caminho, e que a força do amor te guie em todos os momentos da vida.""",2024-07-06
cod_42,"""Cada dia é uma nova oportunidade para sermos melhores e fazermos a diferença na vida daqueles que amamos. Que possamos espalhar amor e compaixão por onde passarmos.""",2024-07-06
cod_43,"""Que a luz da esperança ilumine seu caminho, que a força do amor guie seus passos e que a paz interior seja sua companheira constante. Você é capaz de superar qualquer desafio que a vida te apresentar.""",2024-07-06
cod_44,"""Que a luz da esperança ilumine sempre o seu caminho, guiando-o(a) rumo à paz e à felicidade.""",2024-07-06
cod_45,"""Assim como as estrelas iluminam o céu escuro, que a sua presença ilumine a vida daqueles ao seu redor com amor e esperança.""",2024-07-06
cod_46,"""A vida é como uma obra de arte em constante evolução, onde cada experiência e desafio moldam a nossa essência e a beleza do nosso ser.""",2024-07-06
cod_47,"""Cada desafio que enfrentamos é uma oportunidade de crescimento e aprendizado. Tenha fé em si mesmo e saiba que você é capaz de superar qualquer obstáculo que surgir em seu caminho.""",2024-07-06
cod_48,"""Que a luz da esperança ilumine sempre o seu caminho, mostrando que em toda escuridão há um brilho de superação e amor.""",2024-07-06
cod_49,"""A vida é um presente precioso, não desperdice seu tempo com coisas que não te fazem feliz. Cultive sempre o amor, a gratidão e a compreensão em seu coração, e verá como a felicidade se manifestará em sua vida de forma abundante.""",2024-07-06
cod_50,"""A vida é feita de momentos preciosos, por isso valorize cada instante ao lado daqueles que te fazem feliz.""",2024-07-06
cod_51,"""Que a jornada da vida seja repleta de aprendizados, superações e momentos de alegria que nos fortaleçam e nos tornem cada vez mais gratos pela oportunidade de existir.""",2024-07-06
cod_52,"""Que a luz da esperança guie sempre seus passos, iluminando seu caminho e aquecendo seu coração. Você é capaz de superar qualquer desafio que a vida colocar em seu caminho.""",2024-07-06
cod_53,"""Que a luz da esperança e da gratidão ilumine sempre o caminho do seu coração, trazendo paz e serenidade a cada passo dado.""",2024-07-06
cod_54,"""O caminho da felicidade passa por valorizar os momentos simples da vida e cultivar a gratidão em nosso coração.""",2024-07-06
cod_55,"""Que a luz da esperança guie sempre seus passos e que a força do amor esteja presente em todos os momentos da sua vida.""",2024-07-06
cod_56,"""A vida é feita de momentos, uns mais difíceis, outros mais felizes, mas todos essenciais para o nosso crescimento. Aproveite cada instante e aprenda com cada experiência.""",2024-07-06
cod_57,"""Que a luz da esperança ilumine sempre o seu caminho, guiando-o para a paz e a felicidade que você tanto merece.""",2024-07-06
cod_58,"""Que a luz da esperança ilumine sempre o teu caminho e que a força do amor te guie em cada passo. Você é capaz de superar todos os desafios que a vida te apresentar.""",2024-07-06
cod_59,"""Que a luz da esperança brilhe sempre em seu coração, iluminando seu caminho em meio à escuridão. Confie no seu potencial e nunca desista dos seus sonhos.""",2024-07-06
cod_60,"""Que a luz da esperança ilumine sempre o seu caminho, mostrando que mesmo nas horas mais escuras, há motivos para acreditar na beleza da vida.""",2024-07-06
cod_61,"""Que a luz da esperança guie sempre seus passos e que a força do amor ilumine seu caminho.""",2024-07-06
cod_62,"""Que a luz da esperança guie seus passos e a força do amor fortaleça seu coração em todos os momentos da vida.""",2024-07-06
cod_63,"""A vida é feita de escolhas e cada escolha molda o nosso destino. Escolha sempre com o coração e verá o caminho se iluminar diante de você.""",2024-07-06
cod_64,"""Que a luz da esperança ilumine seu caminho e que a força do amor te guie em cada passo. Você é capaz de conquistar tudo o que deseja, basta acreditar em si mesmo.""",2024-07-06
cod_65,"""A vida é feita de ciclos, altos e baixos, e é importante lembrar que após a escuridão sempre virá a luz. Mantenha a esperança e a fé no coração, pois dias melhores sempre estão por vir.""",2024-07-06
cod_66,"""Que o amor e a gratidão sejam sempre o combustível que guia os seus passos e ilumina o seu caminho.""",2024-07-06
cod_67,"""Que a luz da esperança ilumine sempre o seu caminho, guiando você rumo à felicidade e à realização dos seus sonhos.""",2024-07-06
cod_68,"""Que a luz que habita dentro de você brilhe intensamente, iluminando o caminho dos que estão ao seu redor.""",2024-07-06
cod_69,"""A vida é uma jornada de altos e baixos, mas é nos momentos difíceis que descobrimos nossa força e capacidade de superação. Acredite no seu potencial e siga em frente, pois o melhor ainda está por vir.""",2024-07-06
cod_70,"""Que a luz da esperança ilumine sempre seu caminho e que a força do amor te guie em todas as decisões. Lembre-se, você é capaz de superar qualquer desafio que surgir em seu caminho.""",2024-07-06
cod_71,"""A felicidade é como uma borboleta: quanto mais você a persegue, mais ela foge. Mas se você se ocupar com outras coisas, ela pousará suavemente em seu ombro."" 🦋✨",2024-07-06
cod_72,"""A cada amanhecer, renove suas esperanças e acredite no poder de transformação que existe dentro de você. Seja luz na vida de quem te cerca e espalhe amor por onde passar.""",2024-07-06
cod_73,"""Cada novo amanhecer é uma oportunidade de recomeçar e fazer tudo diferente. Aproveite cada momento e faça valer a pena!""",2024-07-06
cod_74,"""O amor é a maior força do universo, capaz de transformar corações e iluminar caminhos. Cultive-o em seu íntimo e espalhe-o ao seu redor, tornando o mundo um lugar melhor para todos.""",2024-07-06
